绪山まひろ,我有个想法，动物体内的细胞会不会是兽耳呢d(ŐдŐ๑),2018-07-08 00:54:37,9281,0,10
余哇踏诺西,看番还能涨知识，对生物有点帮助，好评,2018-09-30 17:26:58,136,0,10
WNE_02,《工作细胞》让我深刻意识到世上还有那么多那么多细胞爱着我并为我努力着，谢谢! (*≧▽≦),2018-07-12 18:39:12,119,0,10
Till-Dawn,从暑假追到现在，昨天完结撒花。来源于现实，向我们展示了细胞的努力奋斗。在你孤身一人时，仍有37兆细胞为你而战。人物的刻画也十分生动。,2018-10-01 15:03:24,31,0,10
只有小象才能统治世界,好看好看！！！,2018-10-28 16:18:49,0,0,10
暗夜披风,棒到极致，这部番剧让我知道了那些为我们369天每天24小时工作的细胞们的辛勤与牺牲，向细胞们致敬！！！,2018-10-28 15:21:35,0,0,10
elderdriver,真的是好棒啊。一部搞笑番却看得我心里暖暖的,2018-10-28 15:05:05,0,0,10
不信耶稣不信佛,制作水准一直保持到最后，对于故事的叙述也很好,2018-10-28 14:08:28,0,0,10
Angel丶也会哭灬,有趣,2018-10-28 11:54:20,0,0,10
我头像是我的媳妇,完结撒花,2018-10-28 11:19:45,0,0,10
夜飞啊飞,谢谢你们，工作细胞们！因为有你们，我才能生活的这么好，时间最美好的事物一直存在于自己身体里！啊～   活着真好！,2018-10-28 08:19:08,0,0,10
血小板既正义,很好的一部番 推荐初一生物刚学到细胞的同学们看,2018-10-27 16:57:49,1,0,10
夕阳下的呵呵哒,人生,2018-10-28 07:52:27,0,0,10
DeaR灬By天狼,妈鸭 惊呆了 为什么有这么好看的番,2018-10-28 07:44:09,0,0,10
沉沦風叶,好看，还有科普,2018-10-28 03:22:35,0,0,10
守护芙音,宅系数比较低的一部番，年龄段比较广，适合入宅观看，就内容而言，是较为轻松的日常，不过连着看会感觉有点乏味，中间有两三个星期没跟补，结果被B站锁了，13集是百度云补完的，科普知识的话，或多或少能学到一点,2018-10-28 02:07:43,0,0,8
路路路口,很好的一部番，以人体中的细胞为主角，是前所未有的，让人感觉耳目一新，剧情也很不错。红细胞是个路痴，白细胞面冷心热，血小板萌的出血，让人欲罢不能。而且我身体里的细胞都在撒狗粮，我却还是个单身狗？！！！！,2018-10-27 23:50:50,0,0,10
逐风御策,一部很神奇的科普番，设定异常新鲜的日常番，表现手法优秀的少儿番等等。（香菜和血小板真可爱）,2018-10-27 23:49:41,0,0,10
TMD007,巨好看,2018-10-27 23:16:56,0,0,10
琪露诺是勇者,牵手吧，如果说这就是命运的话,2018-10-27 23:09:50,0,0,10
笑露孤独,总之，感谢陪伴。  作为一个理科生，工作细胞教会了很多知识，也明白了一些道理。 感谢陪伴。,2018-10-27 21:30:24,0,0,10
遗忘の神话,超级好看！科普番好棒！,2018-10-27 20:56:52,0,0,10
暮至夜,看了第一集，好的，充会员去了,2018-10-27 20:26:17,0,0,10
旅程视频设计,工作细胞新颖独特，第一次看动画学医学知识，早点出第二季吖。,2018-10-27 20:11:18,0,0,10
氪命玩家麟翀,这是我看过的第二部科普番，第一部是蓝猫淘气三千问 (｀・ω・´),2018-10-27 15:02:30,0,0,10
WalseLau,非常好的科普类动漫、对于生物学和医学来说都有很大的帮助  支持！,2018-10-27 13:30:08,0,0,10
泽野螳螂゚゚゚゚,很一般 仅大会员吃相难看,2018-10-27 12:20:32,0,0,2
雏田雏田雏田雏田雏田,既有科普小知识 内容也丰富  最后一集也很感人,2018-10-27 11:53:17,0,0,10
真真-o-,感动～,2018-10-27 11:50:28,0,0,10
HaSaKi喵呜,不错～～～还有科普的效果23333,2018-10-27 11:48:53,0,0,10
小雪狼a,有点过于血腥，吃饭的时候看不下去,2018-10-27 11:08:31,0,0,8
NAIMABEの暴走,最有意思的教育向动漫了……看完后你会感觉生物老师弱爆了啊23333强烈推荐！！！,2018-10-27 08:16:19,0,0,10
番茄炒西红柿emm,我们所在的世界不也是一个身体，我们不也是这些所谓的细胞吗,2018-10-26 14:15:02,1,0,10
情纯小仙女,好好爱护身体吧,2018-10-03 21:23:27,0,0,10
柒情欸,这部番诠释了几种比较常见的病症，以及对癌细胞的科普还是很好评的，就是集数少了一点！希望出2,2018-10-27 07:19:46,0,0,10
清苔上身,千言万语也表达不了我喜欢这部番,2018-10-27 00:58:32,0,0,10
我还能说什么额,good job,2018-10-27 00:20:19,0,0,10
Ryan老S,作为一部非常具有教育意义的动画，真的炒鸡好看......狗粮真好吃，血小板酱赛高！！！！！,2018-10-26 22:14:35,0,0,10
哦呀君,好看呐,2018-10-26 22:14:15,0,0,10
咲咲菌,为我身体里的细胞献上5颗星,2018-10-26 21:59:16,0,0,10
fz219,血小板太萌了! 高考党表示番补完生物可以提20分5⭐,2018-10-26 19:08:45,0,0,10
主角总受萌萌萌,超有趣,2018-10-26 18:19:47,0,0,10
2223192711,很棒！,2018-10-26 13:24:40,0,0,10
山间有小溪,把人体里的细胞都拟人化感觉很有意思啊！各位，我喜欢树突细胞!开始对人体机能产生了兴趣，上大学之后生物就已经被我忘光了，不过生物果然很有趣啊。,2018-10-26 13:22:45,0,0,8
ATP水解酶,啊啊啊啊啊啊最后一集赚足眼泪！！！13集短小精悍，情节很棒！超爱！,2018-10-21 13:25:46,0,0,10
joongly,语死早只能说真的超棒啊啊啊啊！,2018-10-26 04:46:05,0,0,10
筱筱筱筱筱筱雨,55555趁着大会员还在看完惹,2018-10-25 23:48:08,0,0,10
豪子里昂,这番怎么烁呢。？,2018-10-25 22:49:03,0,0,10
☆群星流转之时★,好看,2018-10-25 19:46:28,0,0,10
azalixu,很好的科普呀,2018-10-25 19:14:15,0,0,10
MSP430E,我也要好好工作才行呢,2018-10-25 16:54:33,0,0,10
妮可妮可妮可妮可妮,5星就完事了,2018-10-25 15:42:35,0,0,10
吾王ZhangQL,我永远喜欢白细胞！！！！！！,2018-10-25 13:23:44,0,0,10
阿尔托莉雅ー潘德拉贡,血小板是要萌死我吗？,2018-10-25 12:45:02,0,0,10
冥帝残月,很好看，值得一看,2018-10-25 11:55:23,0,0,10
殇冰Z,最后一集被弹幕“她虽然总是迷路，但是她的心从来没有迷失方向”这句话泪目了，各位，要爱惜自己的身体啊。             我感觉我是不是应该去献个血。。。,2018-10-08 21:47:29,17,0,10
Wedneston,一部非常优秀的以拟人与科普为主要看点的轻松的番剧，虽然经常会有危机但是也有机会被化解，就像我们的生活一样。  不可以一蹶不振，要快乐，健康第一。,2018-10-25 00:48:10,0,0,10
水寒2013,爱死了，超级好看,2018-10-24 23:43:49,0,0,10
泉此方QAQ,有趣还能科普，重要的是还有香菜！,2018-10-24 23:40:11,0,0,10
剑神秦夕颜,2018年7月新番最大的黑马,2018-10-24 21:13:17,0,0,10
想不到有什么昵称改了,一直存着等完结看，现在看完了，觉得果然自己爱惜自己才最重要！毕竟我体内有那么多可爱的细胞啊～,2018-10-24 20:22:57,0,0,10
下一个僵尸SAMA,非常好看,2018-10-24 17:48:39,0,0,10
chenyiran1036,动漫很好看！！！很新颖的题材，画面也很好！！,2018-10-24 16:24:49,0,0,10
火洣,满分！！！！！！,2018-10-24 14:09:45,0,0,10
悲催光环7,起先是由血小板的cos知道这部剧，第一集看完就为了这部剧专门开了会员，看过之后绝不后悔，话说……血小板是你们的，巨噬细胞我就抱回家啦,2018-10-24 14:03:49,0,0,10
西住美穗ヨ,非常有教育意义的番剧！,2018-10-24 13:51:53,0,0,10
Rie-离,多谢款待,2018-10-24 13:04:11,0,0,10
柠檬青柠檬,还不错,2018-10-24 09:40:28,0,0,10
浪一小,血小板可爱,2018-10-24 08:59:42,0,0,10
烟酒萝莉,感谢我身体里的每一个细胞(๑•̀ㅂ•́)و但为什么那么多勤劳的细胞会构成一个如此懒惰的我QAQ,2018-10-03 11:59:19,21,0,10
_夢毒_,除去一些设计的有点尴尬的地方，其他都蛮好的。五星好评,2018-10-24 02:04:27,0,0,10
初璃北兮,想看第二季,2018-10-24 00:06:54,0,0,10
评论区的脑洞君,最后一集为我们老乡长脸了，重点是东北人很热情的哦。这部番也写出来了这点。不错5星,2018-10-23 23:07:20,0,0,10
henryox,有2吗。。,2018-10-23 23:05:37,0,0,10
家常,长知识，角色萌，让人能很形象的学到一些基础的知识，对于厌烦了死板的书本学生来说是一个提升兴趣的番，对其他人也能凭借着优秀的表现而喜欢，是一个很好的番剧，能做到这些作为一部科普、子供番已经大大超出了。,2018-10-23 22:28:58,0,0,10
沉默的断章,血小板就是正义，身体里的故事，科普向，剧情有趣,2018-10-23 22:12:07,0,0,10
大葡萄媛子,挺好看的 可以了解很多知识 以后说到这些细胞的时候都会想到这些人物 挺好的,2018-10-23 21:43:30,0,0,10
狍子鹿鹿鹿,感觉有点教育意义,2018-10-23 21:31:34,0,0,10
梦-二次元,近年来少有看哭我的番,2018-10-23 20:33:21,0,0,10
月寒曰暖,啊，血小板好可爱！！！！,2018-10-23 15:52:08,0,0,10
汤圆烫,好看好看！,2018-10-23 14:51:18,0,0,10
ZangTianTaoGe,啊  又想见血小板了,2018-10-23 14:13:24,0,0,10
快把这个人拉去学习,“照顾好自己。因为你不仅伤害了自己还伤害了37亿个细胞”,2018-10-23 13:05:54,0,0,10
吕醉卉,好看的很有科普性,2018-10-23 12:05:26,0,0,10
明知早知离别,活着这么久不易啊,2018-10-23 08:59:35,0,0,10
暗夜猫猫猫妖,毕业多年的理科生不要脸滴表示，很亲切的设定～一集一个小故事的形式也不容易崩，毕竟人体内有那么多让人惊叹的小秘密，只要能好好讲出来，就不愁没有好故事。没错我在许愿第二三四...季啦！,2018-10-23 08:29:29,0,0,10
助手さま大好き,超出预期的好的一部番，涨了很多知识的同时又被喂了很多狗粮就是了_(:з」∠)_,2018-10-22 14:13:58,1,0,10
迷路阿飞,外来物种大量入侵B站希望B站的原住民别被新来的取而代之了,2018-08-28 09:48:46,0,0,10
きのしたひでよし,血小板最棒,2018-10-23 03:12:55,0,0,10
水来桑,最成功的一部番剧,2018-10-23 00:52:15,0,0,10
Ta_2達央家的喵酱,深觉受伤真是对不起我体内的细胞们,2018-10-23 00:35:31,0,0,10
饭团的二欢,整体上还行，专业术语整得有点多让我也认真了起来……但还是有些地方槽点也多……想要在这部作品学习专业知识的话只用看方框里的字就够了。,2018-10-22 23:25:35,0,0,8
八百万只喵,辛苦各位啦,2018-10-22 19:25:01,0,0,10
Sakuraと绘梨衣丶,设定新奇，阵容强大，我还能说什么呢,2018-10-22 19:04:16,0,0,10
蠢琊乖乖,血小板！！！,2018-10-22 18:15:15,0,0,10
三四帝,剧情一般,2018-10-22 17:30:18,0,0,8
一只小明LLK,为了自己体内的细胞一定要好好活着！！,2018-10-22 17:25:51,0,0,10
MARKGAO1998,真心感谢这部番以通俗易懂而又励志的形式介绍了人体内各种细胞的功能。仔细想想，体内的细胞们为了维持这副身体的正常运转都这么努力，那么作为这副身体的主人，我又有什么理由不努力活下去呢？,2018-10-22 11:52:23,0,0,10
An安仔_,在我朋友圈空间微博火了这么久的番，终于被我补完了，首先真的很被这种细胞团结的力量打动，其次这部番很有教育作用，可以让大家能够更了解自己的身体内部的状况，要一直健康哦，这部番身体里边的细胞都太可爱了！！,2018-10-22 11:35:07,0,0,10
二月洛阳,一个字棒，俩个字好看，三个字第二季。,2018-10-21 17:16:08,1,0,10
社会l诚哥,emmm看完之后张姿势了,2018-10-21 23:51:17,0,0,10
丿安啦丶,好看ヾ(●´∇｀●)ﾉ哇～,2018-10-21 23:45:50,0,0,10
魔绘小源,很喜欢的一部番剧，用拟人化的形式讲述了人身体的种种变化，看到最后两集莫名伤感。em。。。。。要好好爱惜身体啊米娜,2018-10-21 23:28:23,0,0,10
LAST丶琉璃,喜欢香菜的红血球(≧ω≦)/,2018-10-21 23:09:18,0,0,10
眼罩才是本体233,创意很好，科普性强，1146超帅啊啊啊啊啊啊啊啊,2018-10-21 21:59:35,0,0,10
幻想の电波,迟到的完结撒花，看了之后，感觉更要好好的生活了，不然怎么对得起37兆的细胞们呢2333,2018-10-21 20:37:06,0,0,10
翩然幻蝶若烟花,这番告诉我们要爱惜自己，不要给我们可爱的细胞添麻烦，他们每天那么辛苦,2018-10-21 20:19:13,0,0,10
大魔王0422,值得五星的番剧,2018-10-21 20:15:17,0,0,10
Aoki大酱,其实是科普片。,2018-10-21 19:53:53,0,0,10
亦鱼柚天,话不多说，笔芯。,2018-10-21 18:01:12,0,0,10
御坂美琴09号,哈哈哈，血小板好可爱,2018-10-21 17:49:54,0,0,10
卞卞bili,有意思,2018-10-21 17:29:56,0,0,10
嫌弃不听八爷的人儿,设定很有创意感觉算近些年来挺有创意的番了，但可能因为每集设定是一个症状就是会有种单元剧的感觉，容易缺乏高潮和新鲜感了。但漫画其他番外挺有趣的，也期待动画化啊！,2018-10-21 16:44:33,0,0,10
小可愛崩了,科普番，不錯不錯，另外，5星給白血球~,2018-10-21 14:50:41,0,0,10
新垣结衣正牌男友,五星好评,2018-10-21 14:16:53,0,0,10
一直这样E,我的血小板世界第一可爱ớ ₃ờ,2018-10-21 13:47:49,0,0,10
爱看动漫的发仔,不错的日常科普番,2018-10-21 13:32:56,0,0,10
某部长の橘子酱,棒！,2018-10-21 13:17:45,0,0,10
Clear雨,感谢为学生物的人提供如此生动的教学，也万分感谢让我认识了那么多因我而努力的细胞们啊w,2018-10-21 12:58:44,0,0,10
卡卡弥稀,好喜欢血小板，太有爱了。,2018-10-21 12:20:24,0,0,10
禾奶昔,非常好看！！！！,2018-10-21 11:59:58,0,0,10
曉型二番艦-響,果断五星,2018-10-21 11:43:46,0,0,10
瞪谁谁怀孕哦,老少咸宜。,2018-10-21 10:39:42,0,0,8
吾王剑锋所指啊,结局泪目,2018-10-21 10:38:17,0,0,10
盖被子的猫,我给4颗星是觉得综合来说这个番的质量不错还有一点点科普性质。但还是不是神作,2018-10-21 10:17:56,0,0,8
渚之星,寓教于乐，同时又不失狗粮与搞笑桥段，合而为一，一部别致另类的好番,2018-10-21 08:47:28,0,0,10
姊零寂冢,健康是最好的祝福了！,2018-10-21 08:07:21,0,0,10
ヾ灰白,科普番还是第一次看，另外我永远喜欢红血球( ॑꒳ ॑ ),2018-10-20 22:40:51,1,0,10
靑onion,在医院陪住院的阿公，吸了一辈子烟和潮汕口味，80多岁喉癌和肺气肿，喉咙肿瘤连液体都很难吞咽，日夜倒睡，晚上特别折磨人。看完结集的时候就在想他的身体里是什么样的，细胞的大家都是偏执狂吧。,2018-10-19 12:00:35,2,0,10
河被人,rua，看着过瘾这就对了！整体上来说已经很好了（除了偶尔的崩坏和火柴人以外），话说我没想到细胞也能这么燃。。。。,2018-10-21 01:50:43,0,0,8
ゼラニウムの子,觉得13话把这部番的立意提升了一个层次。前面一直是个科普番还带着一些狗粮，但看完最后一话真的感触很深。连细胞面临绝境都还挣扎着，何况是人呢。希望大家都能爱惜自己的身体，好好活着,2018-10-20 23:52:12,0,0,10
Jay丶偏执,佳作,2018-10-20 22:38:30,0,0,10
肤黑更腹黑的腹黑黑,超棒,2018-10-20 21:25:09,0,0,10
栗包090,学生物的时候头脑都有他们啦 敲可爱好看,2018-10-20 20:51:02,0,0,10
咿呀家小鱼干,超喜欢血小板,2018-10-20 18:58:48,0,0,10
平陽居士,这是我今年看到的最棒的番,2018-10-20 17:39:57,0,0,10
世上第一难事,很有趣的动画，想到身体里有那么多每天都在努力的细胞，我都充满了力量了。还有最重要的一点就是好好照顾身体，长命百岁啊~,2018-10-20 17:27:11,0,0,8
星阶人,这种科普番挺创新的，但剧情有点幼稚了,2018-10-20 16:57:03,0,0,8
青冥月华,没太多说的，很不错的番,2018-10-20 15:40:48,0,0,10
我家艾拉美如画,还行吧，没有想象中那么好看，血小板出现场次太少了，但是白血球好暖，红血球呆萌呆萌哒,2018-10-20 15:31:54,0,0,8
败者吔灰,豁 最后一集没看 看不了了,2018-10-20 14:58:15,0,0,10
丢蕾耂姆,实话，挺有趣的,2018-10-20 13:22:48,0,0,10
逐渐退出哔哩,还行,2018-10-20 12:37:34,0,0,8
翳羽见君,更新完之后就都要会员了，庆幸自己有一集一集的追,2018-10-20 12:12:31,0,0,8
啵啵啵啵啵饽,看番学生物(๑•ั็ω•็ั๑),2018-10-20 10:14:37,0,0,10
花间鹤sun,阿学医的毫无压力阿w血小板好可爱,2018-10-20 10:05:12,0,0,10
小拳拳捶你丫胸口,很不错的一部番,2018-10-20 09:03:39,0,0,10
十三苼,工作细胞真的超级好啊！,2018-10-20 08:32:20,0,0,10
萌萌小肥喵,b站好变态，一播完几天后就只能永久大会员看了…,2018-10-18 21:50:47,2,0,10
摇滚侑用,一集一集追赶过来，结果留下了穷人的眼泪,2018-07-26 22:54:46,0,0,10
GraceAuthor,超级喜欢血小板,2018-10-20 00:44:14,0,0,10
逍遥の翎,真希望高中生物课老师可以拿这部番讲稳态,2018-10-20 00:23:23,0,0,10
桜の思念在凋落丶,一看是是因为在抖音上看到的血小板的样子觉得很可爱才可是对这部番剧开始感兴趣的，后来发现这是一部很好的番剧，以细胞拟人化的方式来科普人体中各个细胞的作用，即可以了解到一定的常识，有可以很愉快轻松的看完它,2018-10-19 23:54:48,0,0,10
ゼロの原点,为了红细胞，不熬夜，睡了！！,2018-10-19 23:41:50,0,0,10
失落-孤魂,一边享受红白狗粮，一边学习，好评,2018-10-19 22:04:33,0,0,10
失去梦想突然变成咸鱼,因为疯传血小板表情包慕名而来，喜欢香菜的声音，每一集都期待红细胞出场（虽然有一集没有红细胞），而且这部番是真正的把生物知识融入到番剧中，在观众看的开心的同时还普及了生物，真的很棒,2018-10-19 21:52:43,0,0,10
胸前的红领巾格外鲜艳,好久没看到这样趣味性和科普性的番了，很期待有后续第二季,2018-10-19 21:40:03,0,0,10
风中流逝的沙,白赤赛高！,2018-10-19 19:44:38,0,0,10
纪阡陌,非常好看！,2018-10-19 18:50:23,0,0,10
君子协会,完美,2018-10-19 14:58:00,0,0,10
海贼妖尾银魂smida,很好看，具有科普性,2018-10-19 12:59:00,0,0,10
钰溪,血小板，万恶之源。,2018-10-19 12:55:24,0,0,10
的哟孤的元,非常好看,2018-10-19 04:59:00,1,0,10
易水肖潇,长知识了,2018-10-19 01:05:35,1,0,10
孤寡小夜曲,如果要让我来点评，我只能说，神番！,2018-10-19 00:30:38,1,0,10
结-城,13565,2018-10-15 23:21:28,0,0,8
FalconBBP,生物生看到这个死而无憾了,2018-10-19 01:18:06,0,0,8
RS-SIEGE,真的强力推荐，适合所有年龄段的人看，感人有趣不乏可爱气息的科普番！,2018-10-19 00:06:35,0,0,10
我帅吗？帅啊！,好看好看！！！,2018-10-18 22:44:02,0,0,10
ゞ晓,非常超级棒的番,2018-10-18 21:28:13,0,0,10
圈圈poi,将科普与动画很好的结合在一起，也基本上没有什么专业性错误，非常推荐啊,2018-10-18 20:12:17,0,0,10
冬秋志,再见了我的血小板，从今天以后就再也看不到你熟悉的声音了，再也听不到你软到心里的声音了。再见了，我会一直等你的再次出现。这是一部很好的番剧，把枯燥无味抽象的东西，生动的表现出来，点个赞。,2018-10-18 20:02:59,0,0,10
白色的城,不错的科普向动漫，尤其适合考前看（笑哭）,2018-10-18 19:59:30,0,0,10
欧尼桑呆,大会员。。。在别的地方看完了,2018-10-18 17:32:01,0,0,6
抄作业高手,高中我要是……看到这个番，能学不好生物嘛？？？？？（小声bb）,2018-10-18 13:29:00,0,0,10
会魔术的小丑写手,科普类动漫，本来就是弱项，所以他的加成分数很高，所以依照动漫本身是8分，然后加成科普…………18分……… 怎么办，最高10分的啊,2018-10-18 11:27:51,0,0,10
魔枪666,不想说话，五星就完了,2018-10-18 11:23:33,0,0,10
尘心_,后期剧情有点无聊,2018-10-06 22:15:08,0,0,2
tony1379,轻松有趣的剧情带点知识普及，很不错的番,2018-10-18 00:02:39,0,0,10
我然机智,吹到爆！,2018-10-17 23:35:07,0,0,10
无量真人,4级了，23333，过来给个好评。,2018-10-17 23:30:13,0,0,10
LECF,有这么多的细胞在支持我，我还有什么理由自暴自弃,2018-10-17 23:19:12,0,0,10
桃桃在线攻天下,太感动了，会好好爱惜自己的身体的,2018-10-17 21:29:59,0,0,10
在下小仙猫,棒棒哒，传递知识,2018-10-17 20:01:09,0,0,10
优风风,л̵ʱªʱªʱª (ᕑᗢᓫา∗)˒,2018-10-17 19:37:55,0,0,10
王玉百合子,有糖有科普有温暖有搞笑，就是这样的动漫才好看呀www,2018-10-17 19:23:41,0,0,10
O小黄豆O,真的很棒的一部科普喜剧，生物课要是都这样教，还有什么学不会的，作者真是人才，最后，感谢我生命中的每一个细胞，你们辛苦了。,2018-10-17 19:07:16,0,0,10
cccabl,超喜欢呦,2018-10-17 16:11:42,0,0,10
TTViz,是一个学习生物的好动漫*｡٩(ˊωˋ*)و*｡,2018-10-17 12:55:15,0,0,10
旀羽灬樂楓,大爱~原来这个世界还是有些人（细胞）在为我们拼过命。以后还是要好好爱护我们的身体啊,2018-10-17 12:33:51,0,0,10
原罪漠天,吞噬,2018-10-17 11:58:29,0,0,8
雪鸠雪鸠小雪鸠,白血球好帅啊，嘤,2018-10-17 10:27:22,0,0,10
岚渊大人,是一部非常好的番了，刚开始以为是一波巨大的狗粮，一想到自己身体里红细胞和白血球在谈恋爱就觉得心塞。看到最后，突然发现很励志。“我虽然会迷路，但从未迷失过心的方向。”这是来自红细胞的态度,2018-10-17 09:51:53,0,0,10
沉迷于动漫和音乐的诺,这是一部非常有意思，有内涵，有意义的番剧，看完《工作细胞》后大家多多少少对自已的身体有了一定的了解，强烈推荐这部《工作细胞》。作为生物上的教材也很不错的一说。总结：能活到今天真不容易，谢谢细胞们。,2018-10-17 08:53:12,0,0,10
想哈师大,啊～～   好好看的动画    特别的治愈   适合各个阶段的人群看,2018-10-17 08:48:09,0,0,10
雪凝玥儿,完结，科普番真的非常棒,2018-07-13 02:17:19,0,0,10
Jhon-_-Harris,我想不用多说什么，让大家的欢呼声告诉你这部番为何值得去看,2018-10-17 01:32:40,0,0,10
嘟了个嘟噜,为了香菜，血小板，还有科普必须给五星,2018-10-17 00:33:39,0,0,10
hadhand,数亿细胞们一直在为你不断地奋斗，而你又有什么理由不努力的活下去、努力下去呢。,2018-10-16 23:49:34,0,0,10
gary21539,非常有趣!,2018-10-16 21:34:53,0,0,10
时崎洛糸,666,2018-10-16 21:10:04,0,0,10
啼鸟恋诗,真的超级好看！被细胞们治愈了~,2018-10-16 15:52:52,0,0,10
我如是道,真的...........................,2018-10-16 15:26:23,0,0,10
神作观测者,心目中已经很钢炼石头门一个等级了，剧情，人设制作都是顶级，富有科学知识，或微妙或强烈的感情。愿工作细胞能被更多人记住，成为流传起来的神作。,2018-10-16 14:02:16,0,0,10
怀梦撞南墙い,啊啊啊啊啊啊啊啊啊啊啊啊啊,2018-10-16 13:54:18,0,0,8
学医救不了智障队友,还行,2018-10-16 13:20:58,0,0,10
杀老师的布丁,制作水平不错，但目前除了血小板没什么亮点,2018-10-16 13:04:43,0,0,8
乐观至丶上,当遇事不顺的时候，想想身体里还有好几百亿的细胞们在为了你而努力的工作，你还有什么理由不振作起来呢？健康快乐的生活下去吧！！！,2018-10-16 12:35:23,0,0,10
梦寻仙缘,好评，力推。,2018-10-16 08:51:21,0,0,10
阿狼小宇,我为了你成为大会员,2018-10-15 13:18:09,1,0,10
失去梦想的训练师,能学到东西番在我眼里都是好番!,2018-10-16 02:37:07,0,0,10
仔细听朕说,很优秀，很好看。我的细胞很努力，我却很懒，我的细胞很爱情，我却死宅，我的血小板很可爱，我也很可爱,2018-10-16 01:55:57,0,0,8
何其有辜sama,就怕科普番煽情，哭死我了，期待下一季，想看红白cpr18本子哇,2018-10-16 01:05:39,0,0,10
凹凸Man特别胸,我准备去献血，白哥你有何看法？,2018-10-16 01:00:44,0,0,10
零玖的梦,真的是一部超棒的科普番！,2018-10-16 00:12:15,0,0,10
胖樱的铲屎官嗷呜,反手一个五星,2018-10-15 23:30:57,0,0,10
_栀子w,(〜￣▽￣)〜,2018-10-15 22:51:22,0,0,10
二萌好萌好可爱,血小板好可爱！好萌啊啊啊啊啊啊啊啊！！！,2018-10-15 22:32:51,0,0,10
牛顿是只猫,可爱可爱！,2018-10-15 22:24:28,0,0,10
半拉儿柯基,虽说看起来有点幼稚，画风也没有太精致，不过总体剧情挺有新意也科普了一些知识，最后两集真的不错哈哈,2018-10-15 22:16:45,0,0,8
一个没有存在感的人,放心吧，这些不是你的细胞。你的细胞就像这样→凸⊙ω⊙凸,2018-10-15 22:07:23,0,0,10
不会取名的UP主,完结撒花～,2018-10-15 21:22:55,0,0,10
Uopeson,OvO,2018-10-15 21:06:26,0,0,10
天宁最棒了,工作细胞这个作品可以说十分的真实而且达到了富有寓意，让人切实的知道自己身体内细胞的可贵，同时增进了生物知识，还是十分推荐的~,2018-10-15 20:34:24,0,0,10
Inori怜祈,我真的觉得生物课可以看这番了,2018-10-15 20:20:02,0,0,10
15700842636pxr,还不错啊,2018-10-15 20:05:51,0,0,8
